{
  "id": "shadow-wraith",
  "deck": "ghost",
  "initiativeOffset": -5,
  "normal": { "hp": 4, "move": 3, "attack": 2, "flying": true },
  "elite": { "hp": 6, "move": 3, "attack": 3, "flying": true },
  "traits": [{ "trait": "rangedAttacksAgainstHaveDisadvantage" }],
  "forkCards": [
    {
      "id": "shadow-wraith.chill-touch",
      "initiative": 30,
      "if": "twoOrMoreHeroesAdjacent",
      "steps": [{ "type": "attack", "value": -1, "targetAll": "adjacentEnemies", "conditions": ["muddle"] }],
      "otherwise": [{ "type": "move", "value": 1 }, { "type": "attack", "value": 0 }]
    }
  ],
  "model": "assets/models/shadow-wraith.glb"
}
