{
  "id": "thornling",
  "deck": "guard",
  "initiativeOffset": 5,
  "normal": { "hp": 5, "move": 1, "attack": 2, "retaliate": 1 },
  "elite": { "hp": 8, "move": 1, "attack": 3, "retaliate": 2 },
  "forkCards": [
    {
      "id": "thornling.prickly-bush",
      "initiative": 35,
      "if": "selfHpAtMostHalf",
      "steps": [
        { "type": "heal", "value": 2, "target": "self" },
        { "type": "retaliate", "value": 1, "duration": "round" }
      ],
      "otherwise": [{ "type": "attack", "value": 0 }, { "type": "retaliate", "value": 1, "duration": "round" }]
    },
    {
      "id": "thornling.thorny-embrace",
      "initiative": 62,
      "if": "twoOrMoreHeroesAdjacent",
      "steps": [{ "type": "attack", "value": 0, "targetAll": "adjacentEnemies", "conditions": ["immobilize"] }],
      "otherwise": [{ "type": "move", "value": 0 }, { "type": "attack", "value": 1 }]
    }
  ],
  "model": "assets/models/thornling.glb"
}
