{
  "id": "grey-wolf",
  "deck": "melee",
  "initiativeOffset": -8,
  "normal": { "hp": 4, "move": 4, "attack": 2 },
  "elite": { "hp": 6, "move": 4, "attack": 3, "onAttack": ["wound"] },
  "forkCards": [
    {
      "id": "grey-wolf.pack",
      "initiative": 30,
      "steps": [
        { "type": "move", "value": 1 },
        { "type": "attack", "value": 0, "bonuses": [{ "if": "sameTypeAdjacentToTarget", "attack": 1 }] }
      ]
    },
    {
      "id": "grey-wolf.howl",
      "initiative": 52,
      "if": "selfHpAtMostHalf",
      "steps": [
        { "type": "special", "name": "retreat", "params": { "distance": 2 } },
        { "type": "special", "name": "packRally", "params": { "move": 1 } }
      ],
      "otherwise": [{ "type": "move", "value": -1 }, { "type": "attack", "value": 2 }]
    }
  ],
  "model": "assets/models/grey-wolf.glb"
}
